chapter,verse,sanskrit,hindi,english,explanation,emotion,source
2,47.0,कर्मण्येवाधिकारस्ते मा फलेषु कदाचन,"तुम्हें केवल कर्म करने का अधिकार है, फलों में कभी नहीं","You have right to perform actions, never to fruits of actions","तनाव से मुक्ति का सूत्र - फल की चिंता छोड़ो, बस कर्म करो",stress,Bhagavad Gita
6,17.0,युक्ताहारविहारस्य युक्तचेष्टस्य कर्मसु,"संतुलित आहार, विहार, कर्म और नींद वाला व्यक्ति","One with balanced eating, sleeping, work and recreation","तनाव कम करने के लिए दिनचर्या संतुलित रखो - खाना, सोना, काम सब नियमित करो",stress,Bhagavad Gita
2,14.0,मात्रास्पर्शास्तु कौन्तेय शीतोष्णसुखदुःखदाः,"सर्दी-गर्मी, सुख-दुःख तो आने-जाने वाले हैं","Cold-heat, pleasure-pain are temporary, O Arjuna","तनाव और सुख अस्थायी हैं - इन्हें सहन करना सीखो, घबराओ मत",stress,Bhagavad Gita
2,56.0,दुःखेष्वनुद्विग्नमनाः सुखेषु विगतस्पृहः,"दुःख में जो विचलित नहीं होता, सुख में जो आसक्त नहीं","One not disturbed in misery, nor attached to happiness",चिंता तब होती है जब मन अस्थिर हो - समता सीखो,anxiety,Bhagavad Gita
6,35.0,असंशयं महाबाहो मनो दुर्निग्रहं चलम्,"हे अर्जुन, मन चंचल है परंतु अभ्यास से वश में हो सकता है","Mind is restless but can be controlled by practice, O Arjuna","चिंता और बेचैनी पर काबू पाने के लिए नियमित अभ्यास करो - ध्यान, योग, प्राणायाम",anxiety,Bhagavad Gita
4,40.0,अज्ञश्चाश्रद्दधानश्च संशयात्मा विनश्यति,संशयग्रस्त व्यक्ति न तो इस लोक में सुखी होता है न परलोक में,The doubting soul has no happiness in this world or next,चिंता और संशय सुख नहीं देते - विश्वास रखो और आगे बढ़ो,anxiety,Bhagavad Gita
2,3.0,क्लैब्यं मा स्म गमः पार्थ नैतत्त्वय्युपपद्यते,"हे पार्थ, कायरता मत दिखाओ, यह तुझे शोभा नहीं देती","Do not yield to unmanliness, O Arjuna, it does not become you","हिम्मत मत हारो! उठो, जागो और अपने लक्ष्य की ओर बढ़ो",motivation,Bhagavad Gita
11,33.0,तस्मात्त्वमुत्तिष्ठ यशो लभस्व,इसलिए तू उठ खड़ा हो और यश प्राप्त कर,Therefore arise and attain glory,प्रेरणा चाहिए? उठो और कर्म करो! सफलता तुम्हारा इंतज़ार कर रही है,motivation,Bhagavad Gita
3,21.0,यद्यदाचरति श्रेष्ठस्तत्तदेवेतरो जनः,"श्रेष्ठ व्यक्ति जैसा करता है, दूसरे वैसा ही करते हैं","Whatever a great man does, others follow","तुम बदलाव ला सकते हो - खुद बनो प्रेरणा, दूसरे तुम्हारा अनुसरण करेंगे",motivation,Bhagavad Gita
4,34.0,तद्विद्धि प्रणिपातेन परिप्रश्नेन सेवया,"नम्रता से पूछो, सेवा करो, ज्ञानी से सीखो",Learn from wise by humble inquiry and service,भ्रम हो तो गुरु से पूछो - ज्ञानी लोग तुम्हारा मार्गदर्शन कर सकते हैं,confusion,Bhagavad Gita
18,61.0,ईश्वरः सर्वभूतानां हृद्देशेऽर्जुन तिष्ठति,ईश्वर सबके हृदय में विराजमान है,The Lord is situated in everyone's heart,भ्रम में हो तो अपने अंतर्मन की आवाज़ सुनो - जवाब अंदर ही है,confusion,Bhagavad Gita
10,10.0,तेषां सततयुक्तानां भजतां प्रीतिपूर्वकम्,"जो निरंतर मुझसे प्रेम से जुड़े हैं, उन्हें मैं ज्ञान देता हूँ","To those constantly devoted with love, I give understanding",भ्रम दूर करने के लिए श्रद्धा और प्रेम से जुड़ो - स्पष्टता आएगी,confusion,Bhagavad Gita
5,21.0,बाह्यस्पर्शेष्वसक्तात्मा विन्दत्यात्मनि यत्सुखम्,"जो बाहरी सुखों में आसक्त नहीं, वह आत्मा में सुख पाता है",One not attached to external pleasures finds happiness within,"सच्ची खुशी बाहर नहीं, अंदर है - अपने आपको जानो",happiness,Bhagavad Gita
6,27.0,प्रशान्तमनसं ह्येनं योगिनं सुखमुत्तमम्,शांत मन वाला योगी परम सुख पाता है,The yogi with peaceful mind attains highest happiness,"खुशी का रास्ता है शांत मन - ध्यान करो, अपने अंदर झाँको",happiness,Bhagavad Gita
17,8.0,आयुःसत्त्वबलारोग्यसुखप्रीतिविवर्धनाः,"जो खाना आयु, बल, सेहत और खुशी बढ़ाएं","Foods that increase life, strength, health and happiness","स्वस्थ रहना है तो सात्विक खाना खाओ - पौष्टिक, ताजा, हल्का",general,Bhagavad Gita
13,8.0,अमानित्वमदम्भित्वमहिंसा क्षान्तिरार्जवम्,"विनम्रता, अहिंसा, धैर्य और सरलता - यही ज्ञान है","Humility, non-violence, patience, simplicity - these are knowledge","अच्छे जीवन के ये गुण - नम्रता, अहिंसा, धैर्य, सरलता अपनाओ",general,Bhagavad Gita
2,48.0,योगस्थः कुरु कर्माणि सङ्गं त्यक्त्वा धनञ्जय,"योग में स्थित होकर कर्म करो, आसक्ति छोड़कर","Perform actions staying in yoga, abandoning attachment","जीवन का मूल मंत्र - कर्तव्य करो, फल की चिंता मत करो",general,Bhagavad Gita
1,1.1,धृतराष्ट्र उवाच । धर्मक्षेत्रे कुरुक्षेत्रे समवेता युयुत्सवः मामकाः पाण्डवाश्चैव किमकुर्वत सञ्जय ॥...,"धृतराष्ट्र बोले- हे संजय! धर्मभूमि कुरुक्षेत्र में एकत्रित, युद्ध की इच्छावाले मेरे और पाण्डु के पुत्रों ने क्या किया?","Dhrtarashtra asked of Sanjaya: O SANJAYA, what did my warrior sons and those of Pandu do when they were gathered at KURUKSHETRA, the field of religious activities? Tell me of those happenings.","Dhrtarashtra asked of Sanjaya: O SANJAYA, what did my warrior sons and those of Pandu do when they were gathered at KURUKSHETRA, the field of religious activities? Tell me of those happenings.",general,Bhagavad Gita
1,1.2,सञ्जय उवाच । दृष्ट्वा तु पाण्डवानीकं व्यूढं दुर्योधनस्तदा आचार्यमुपसङ्गम्य राजा वचनमब्रवीत् ॥ १.२ ...,संजय बोले- उस समय राजा दुर्योधन ने व्यूहरचनायुक्त पाण्डवों की सेना को देखा और द्रोणाचार्य के पास जाकर यह वचन कहा|,"Sanjaya explained: Now seeing that the army of the PANDAVAS was set up properly, the Price DURYODHANA called his teacher, DRONA, to his side and spoke these words:","Sanjaya explained: Now seeing that the army of the PANDAVAS was set up properly, the Price DURYODHANA called his teacher, DRONA, to his side and spoke these words:",general,Bhagavad Gita
1,1.3,पश्यैतां पाण्डुपुत्राणामाचार्य महतीं चमूम् । व्यूढां द्रुपदपुत्रेण तव शिष्येण धीमता ॥ १.३ ॥,हे आचार्य! आपके बुद्धिमान्‌ शिष्य द्रुपदपुत्र धृष्टद्युम्न द्वारा व्यूहाकार खड़ी की हुई पाण्डुपुत्रों की इस बड़ी भारी सेना को देखिए|,"Behold O, Master, the mighty army of the sons of PANDU, led by the son of DRUPADA, your talented disciple.","Behold O, Master, the mighty army of the sons of PANDU, led by the son of DRUPADA, your talented disciple.",general,Bhagavad Gita
1,1.4,अत्र शूरा महेष्वासा भीमार्जुनसमा युधि । युयुधानो विराटश्च द्रुपदश्च महारथः ॥ १.४ ॥,"इस सेना में बड़े-बड़े धनुषों वाले तथा युद्ध में भीम और अर्जुन के समान शूरवीर सात्यकि और विराट तथा महारथी राजा द्रुपद, धृष्टकेतु और चेकितान तथा बलवान काशिराज, पुरुजित, कुन्तिभोज और मनुष्यों में श्रेष्ठ शैब्य, पराक्रमी युधामन्यु तथा बलवान उत्तमौजा, सुभद्रापुत्र अभिमन्यु एवं द्रौपदी के पाँचों पुत्र- ये सभी महारथी हैं","Present here are the mighty archers, peers or friends, in warfare, of ARJUNA and BHIMA. Their names are: YUYUDHANA, VIRATA and DRUPADA, the great chariot-warrior. Other great warriors were also present on the battlefield: DHRSHTAKEUT, CHEKITANA and the brave and noble King of Kasi, KUNTIBHIJA and SAIBYA; these are among the great warriors. Other courageous and great chariot-warriors were: YUDHAMANYU, the brave UTTAMAUJA, SAUBHADRA, and the sons of DRAUPADI.","Present here are the mighty archers, peers or friends, in warfare, of ARJUNA and BHIMA. Their names are: YUYUDHANA, VIRATA and DRUPADA, the great chariot-warrior. Other great warriors were also present on the battlefield: DHRSHTAKEUT, CHEKITANA and the brave and noble King of Kasi, KUNTIBHIJA and SAIBYA; these are among the great warriors. Other courageous and great chariot-warriors were: YUDHAMANYU, the brave UTTAMAUJA, SAUBHADRA, and the sons of DRAUPADI.",motivation,Bhagavad Gita
1,1.5,धृष्टकेतुश्चेकितानः काशिराजश्च वीर्यवान् । पुरुजित्कुन्तिभोजश्च शैब्यश्च नरपुङ्गवः ॥ १.५ ॥,"धृष्टकेतु, चेकिताना, और काशी के बहादुर राजा, पुरुजीत और कुंतीभोज और सैब्य, सबसे अच्छे पुरुष।","Dhrishtaketu, Chekitana, and the valiant king of Kashi, Purujit and Kuntibhoja and Saibya, the best of men.","Dhrishtaketu, Chekitana, and the valiant king of Kashi, Purujit and Kuntibhoja and Saibya, the best of men.",general,Bhagavad Gita
1,1.6,युधामन्युश्च विक्रान्त उत्तमौजाश्च वीर्यवान् । सौभद्रो द्रौपदेयाश्च सर्व एव महारथाः ॥ १.६ ॥,"बलवान युधमन्यु और वीर उत्तमौज, सुभद्रा के पुत्र और द्रौपदी के पुत्र, वे सभी, मंडल सेनापति।","The strong Yudhamanyu and the brave Uttamaujas, the son of Subhadra and the sons of Draupadi, all of them, divisional commanders.","The strong Yudhamanyu and the brave Uttamaujas, the son of Subhadra and the sons of Draupadi, all of them, divisional commanders.",general,Bhagavad Gita
1,1.7,अस्माकं तु विशिष्टा ये तान्निबोध द्विजोत्तम । नायका मम सैन्यस्य संज्ञार्थं तान्ब्रवीमि ते ॥ १.७ ॥,"हे ब्राह्मणश्रेष्ठ ! अपने पक्ष में भी जो प्रधान हैं, उनको आप समझ लीजिये । आपकी जानकारी के लिये मेरी सेना के जो-जो सेनापति हैं, उनको बतलाता हूँ ।","Duryodhana spoke unto his master Drona: O Best of the twice born, I name all of those who are our distinguished Chiefs, the leaders of my army, of your information only.","Duryodhana spoke unto his master Drona: O Best of the twice born, I name all of those who are our distinguished Chiefs, the leaders of my army, of your information only.",general,Bhagavad Gita
1,1.8,भवान्भीष्मश्च कर्णश्च कृपश्च समितिंजयः । अश्वत्थामा विकर्णश्च सौमदत्तिस्तथैव च ॥ १.८ ॥,"आप —– द्रोणाचार्य और पितामह भीष्म तथा कर्ण और संग्रामविजयी कृपाचार्य तथा वैसे ही अश्वत्थामा, विकर्ण और सोमदत्त का पुत्र भूरिश्रवा ।","Your wise self, BHISMA, KARNA, KRIPA, the victorious in fight; ASVATTHAMA, VIKARNA and SAUMADATTI as well.","Your wise self, BHISMA, KARNA, KRIPA, the victorious in fight; ASVATTHAMA, VIKARNA and SAUMADATTI as well.",motivation,Bhagavad Gita
1,1.9,अन्ये च बहवः शूरा मदर्थे त्यक्तजीविताः । नानाशस्त्रप्रहरणाः सर्वे युद्धविशारदाः ॥ १.९ ॥,और भी मेरे लिये जीवन की आशा त्याग देने वाले बहुत से शूरवीर अनेक प्रकार के शस्त्रास्त्रों से सुसज्जित और सब-के-सब युद्ध में चतुर हैं ।,"Duryodhana further said to Drona: Yet several other heroes and great men, well-trained in combat, armed with assorted powerful weapons and missiles, are ready to lay down their lives for me!","Duryodhana further said to Drona: Yet several other heroes and great men, well-trained in combat, armed with assorted powerful weapons and missiles, are ready to lay down their lives for me!",general,Bhagavad Gita
1,1.11,अयनेषु च सर्वेषु यथाभागमवस्थिताः । भीष्ममेवाभिरक्षन्तु भवन्तः सर्व एव हि ॥ १.११ ॥,इसलिये सब मोर्चों पर अपनी-अपनी जगह स्थित रहते हुए आप लोग सभी नि:संदेह भीष्मपितामह की सब और से रक्षा करें ।,"Duryodhana instructed his army: Now all of you quickly assume your proper positions for battle, your main goal being to protect and fight alongside BHISMA, your leader, by all means.","Duryodhana instructed his army: Now all of you quickly assume your proper positions for battle, your main goal being to protect and fight alongside BHISMA, your leader, by all means.",motivation,Bhagavad Gita
1,1.12,तस्य सञ्जनयन्हर्षं कुरुवृद्धः पितामहः । सिंहनादं विनद्योच्चैः शङ्खं दध्मौ प्रतापवान् ॥ १.१२ ॥,कोरवों में वृद्ब बड़े प्रतापी पितामह भीष्म ने उस दुर्योधन के ह्रदय में हर्ष उत्पन्न करते हुए उच्च स्वर से सिंह की दहाड़ के समान गरजकर शंख बजाया ।,"To bring joy to DURYODHANA’s heart, the great grandsire BHISMA, the oldest and most famous of the KAURAVAS, roared loudly like a lion (a battle-cry), and blew his conch to signal the army to advance towards the enemy.","To bring joy to DURYODHANA’s heart, the great grandsire BHISMA, the oldest and most famous of the KAURAVAS, roared loudly like a lion (a battle-cry), and blew his conch to signal the army to advance towards the enemy.",happiness,Bhagavad Gita
1,1.13,ततः शङ्खाश्च भेर्यश्च पणवानकगोमुखाः । सहसैवाभ्यहन्यन्त स शब्दस्तुमुलोऽभवत् ॥ १.१३ ॥,"इसके पश्चात् शंख और नगारे तथा ढोल, मृदंग और नरसिंघे आदि बाजे एक साथ ही बज उठे । उनका वह शब्द बड़ा भयंकर हुआ ।","Tremendous noise followed. Conches, kettle-drums, tabors, and trumpets and cowhorns blared across the battlefield.","Tremendous noise followed. Conches, kettle-drums, tabors, and trumpets and cowhorns blared across the battlefield.",general,Bhagavad Gita
1,1.14,ततः श्वेतैर्हयैर्युक्ते महति स्यन्दने स्थितौ । माधवः पाण्डवश्चैव दिव्यौ शङ्खौ प्रदध्मतुः ॥ १.१४ ॥,इसके अनन्तर सफेद घोडों से युक्त्त उत्तम रथ में बैठे हुए श्रीकृष्ण महाराज और अर्जुन ने भी अलौकिक शंख बजाये ।,MADHAVA (Lord Krishna) and PANDAVA were seated in their magnificent chariote attached to white horses and they blew gracefully their divine conches.,MADHAVA (Lord Krishna) and PANDAVA were seated in their magnificent chariote attached to white horses and they blew gracefully their divine conches.,general,Bhagavad Gita
1,1.15,पाञ्चजन्यं हृषीकेशो देवदत्तं धनञ्जयः । पौण्ड्रं दध्मौ महाशङ्खं भीमकर्मा वृकोदरः ॥ १.१५ ॥,"श्रीकृष्ण महाराज ने पाञ्चजन्य-नामक, अर्जुन ने देवदत्त-नामक और भयानक कर्मवाले भीमसेन ने पौण्ड्र-नामक महाशंख बजाया ।",The PANCHAJANYA (the name of one of the conches) was blown by HRISHIKESA (Lord Krishna). The conch named DEVADATTA was blown by DHANANJAYA (Arjuna).,The PANCHAJANYA (the name of one of the conches) was blown by HRISHIKESA (Lord Krishna). The conch named DEVADATTA was blown by DHANANJAYA (Arjuna).,general,Bhagavad Gita
1,1.16,अनन्तविजयं राजा कुन्तीपुत्रो युधिष्ठिरः । नकुलः सहदेवश्च सुघोषमणिपुष्पकौ ॥ १.१६ ॥,कुन्तीपुत्र राजा युधिष्ठिर ने अनन्तविजय-नामक और नकुल तथा सहदेव ने सुघोष और मणिपुष्पक नामक शंख बजाये ।,The King YUDISHTHIRA. the son of KUNTI blew the great conch called ANANTAVIYAYA: NAKUL and  SAHDEV blew SUGHOSHA and MANIPUSHPAKA (also names of conches).,The King YUDISHTHIRA. the son of KUNTI blew the great conch called ANANTAVIYAYA: NAKUL and  SAHDEV blew SUGHOSHA and MANIPUSHPAKA (also names of conches).,general,Bhagavad Gita
1,1.17,काश्यश्च परमेष्वासः शिखण्डी च महारथः । धृष्टद्युम्नो विराटश्च सात्यकिश्चापराजितः ॥ १.१७ ॥,"श्रेष्ठ धनुषवाले काशिराज और महारथी शिखण्डी एवं धृष्टधुम्न तथा राजा विराट और अजेय सात्यकि राजा द्रु पद एवं द्रौपदी के पाँचो पुत्र और बड़ी भुजावाले सुभद्रापुत्र अभिमन्यु —- इन सभी ने, हे राजन् ! सब ओर से अलग-अलग शंख बजाये ।","Several conches were also blown by: The ruler of KASI. the great warrior SIKHANDI, DHRSTHTADYUMNA, VIRATA, and SATYAKI, the invincible. DRUPADA and the sons of DRAUPADI, and the mighty armed son of SUBHADRA also blew their several conches.","Several conches were also blown by: The ruler of KASI. the great warrior SIKHANDI, DHRSTHTADYUMNA, VIRATA, and SATYAKI, the invincible. DRUPADA and the sons of DRAUPADI, and the mighty armed son of SUBHADRA also blew their several conches.",general,Bhagavad Gita
1,1.18,द्रुपदो द्रौपदेयाश्च सर्वशः पृथिवीपते । सौभद्रश्च महाबाहुः शङ्खान्दध्मुः पृथक्पृथक् ॥ १.१८ ॥,"द्रुपद और द्रौपदी के पुत्रों, हे पृथ्वी के भगवान, और सुभद्रा के पुत्र, शक्तिशाली सशस्त्र, ने अपने-अपने शंख उड़ा दिए।","Drupada and the sons of Draupadi, O Lord of the Earth, and the son of Subhadra, the mighty armed, blew their respective conches.","Drupada and the sons of Draupadi, O Lord of the Earth, and the son of Subhadra, the mighty armed, blew their respective conches.",general,Bhagavad Gita
1,1.19,स घोषो धार्तराष्ट्राणां हृदयानि व्यदारयत् । नभश्च पृथिवीं चैव तुमुलोऽभ्यनुनादयन् ॥ १.१९ ॥,और उस भयानक शब्द ने आकाश और पृथ्वी-को भी गुँजाते हुए धार्तराष्ट्रों के अर्थात् आपके पक्षवालों के ह्रदय विदीर्ण कर दिये ।,The earth and sky was filled with the extremely loud and terrible noise of the PANDAVAS’ bugles and voices which struck fear in the hearts of the KAURAVAS (the sons of Dhrtarashtra).,The earth and sky was filled with the extremely loud and terrible noise of the PANDAVAS’ bugles and voices which struck fear in the hearts of the KAURAVAS (the sons of Dhrtarashtra).,anxiety,Bhagavad Gita
