chapter,verse,sanskrit,hindi,english,explanation,emotion,source
13,13.32,अनादित्वान्निर्गुणत्वात्परमात्मायमव्ययः । शरीरस्थोऽपि कौन्तेय न करोति न लिप्यते ॥ १३.३२ ॥,हे अर्जुन ! अनादि होने से और निर्गुण होने से यह अविनाशी परमात्मा शरीर में स्थित होने पर भी वास्तव में न तो कुछ करता है और न लिप्त ही होता है |,"The Supreme Self without beginning, without qualities, imperishable, though dwelling in the body, O Arjuna, neither acts nor is attached to any action.","The Supreme Self without beginning, without qualities, imperishable, though dwelling in the body, O Arjuna, neither acts nor is attached to any action.",stress,Bhagavad Gita
13,13.33,यथा सर्वगतं सौक्ष्म्यादाकाशं नोपलिप्यते । सर्वत्रावस्थितो देहे तथात्मा नोपलिप्यते ॥ १३.३३ ॥,"जिस प्रकार सर्वत्र व्याप्त आकाश सूक्ष्म होने के कारण लिप्त नहीं होता, वैसे ही देह में सर्वत्र स्थित आत्मा निर्गुण होने के कारण देह के गुणों से लिप्त नहीं होता|","As the all pervading ether (sky) is not affected, by reasons of subtlety, so the Self (soul) seated in the body is not affected.","As the all pervading ether (sky) is not affected, by reasons of subtlety, so the Self (soul) seated in the body is not affected.",general,Bhagavad Gita
13,13.34,यथा प्रकाशयत्येकः कृत्स्नं लोकमिमं रविः । क्षेत्रं क्षेत्री तथा कृत्स्नं प्रकाशयति भारत ॥ १३.३४ ॥,"हे अर्जुन ! जिस प्रकार एक ही सूर्य इस सम्पूर्ण ब्रह्माण्ड को प्रकाशित करता है, उसी प्रकार एक ही आत्मा सम्पूर्ण क्षेत्र को प्रकाशित करता है|","Just as the one sun illuminates the whole world, so also the Lord of the field (Supreme Self) illuminates the whole field, O Arjuna.","Just as the one sun illuminates the whole world, so also the Lord of the field (Supreme Self) illuminates the whole field, O Arjuna.",general,Bhagavad Gita
13,13.35,क्षेत्रक्षेत्रज्ञयोरेवमन्तरं ज्ञानचक्षुषा । भूतप्रकृतिमोक्षं च ये विदुर्यान्ति ते परम् ॥ १३.३५ ॥,"इस प्रकार क्षेत्र और क्षेत्रज्ञ के भेद को कार्य सहित तथा प्रकृति से मुक्त्त होने को जो पुरुष ज्ञान नेत्रों द्वारा तत्व से जानते हैं, वे महात्मा जन परम ब्रह्म परमात्मा को प्राप्त होते हैं |","They who know through the eye of intuition, this distinction between the field and its knower and also perceive the liberation from the Nature of being, go to the Supreme.","They who know through the eye of intuition, this distinction between the field and its knower and also perceive the liberation from the Nature of being, go to the Supreme.",general,Bhagavad Gita
14,14.1,श्रीभगवानुवाच । परं भूयः प्रवक्ष्यामि ज्ञानानां ज्ञानमुत्तमम् यज्ज्ञात्वा मुनयः सर्वे परां सिद्धिम...,"श्रीभगवान् बोले —-ज्ञानों में भी अति उत्तम उस परम ज्ञान को मैं फिर कहूँगा, जिसको जानकर सब मुनि जन इस संसार से मुक्त्त होकर परम सिद्भि को प्राप्त हो गये हैं |","The blessed Lord spoke: Now Arjuna, I shall expose to you the most supreme and highest of all the wisdom in this universe by which all the great sages in this universe have achieved the highest perfection.","The blessed Lord spoke: Now Arjuna, I shall expose to you the most supreme and highest of all the wisdom in this universe by which all the great sages in this universe have achieved the highest perfection.",general,Bhagavad Gita
14,14.2,इदं ज्ञानमुपाश्रित्य मम साधर्म्यमागताः । सर्गेऽपि नोपजायन्ते प्रलये न व्यथन्ति च ॥ १४.२ ॥,इस ज्ञान को आश्रय करके अर्थात धारण करके मेरे स्वरूप को प्राप्त हुए पुरुष सृष्टि के आदि में पुन: उत्पन्न नहीं होते और प्रलय काल में भी व्याकुल नहीं होते|,"By fully learning, understanding and practising this wisdom, these sages have become a part of Me. As a result, they are not born at the time of creation nor do they pass away at the time of destruction of the universe.","By fully learning, understanding and practising this wisdom, these sages have become a part of Me. As a result, they are not born at the time of creation nor do they pass away at the time of destruction of the universe.",stress,Bhagavad Gita
14,14.3,मम योनिर्महद्ब्रह्म तस्मिन्गर्भं दधाम्यहम् । संभवः सर्वभूतानां ततो भवति भारत ॥ १४.३ ॥,हे अर्जुन ! मेरी महत्-ब्रह्म रूप मूल प्रकृति सम्पूर्ण भूतों की योनि है अर्थात् गर्भाधान का स्थान है और मैं उस योनि में चेतन समुदाय रूप गर्भ को स्थापन करता हूँ । उस जड़ चेतन के संयोग से सब भूतों की उत्पत्ति होती है |,"O Arjuna, you must realize that it is from Me that all creation steam. The great Brahma, The Lord of all creation acts as My womb when I plant the seed of creation from which all beings evolve.","O Arjuna, you must realize that it is from Me that all creation steam. The great Brahma, The Lord of all creation acts as My womb when I plant the seed of creation from which all beings evolve.",general,Bhagavad Gita
14,14.4,सर्वयोनिषु कौन्तेय मूर्तयः संभवन्ति याः । तासां ब्रह्म महद्योनिरहं बीजप्रदः पिता ॥ १४.४ ॥,"हे अर्जुन ! नाना प्रकार की सब योनियों में जितनी मूर्तियां अर्थात् शरीर धारी प्राणी उत्पन्न होते हैं, प्रकृति तो उन सब की गर्भ धारण करने वाली माता है और मै बीज को स्थापन करने वाला पिता हूँ |","The blessed Lord said:Dear Arjuna, know that whenever and wherever a being is born, I am his parents, that is, both his mother and father, who gave him life in this world.","The blessed Lord said:Dear Arjuna, know that whenever and wherever a being is born, I am his parents, that is, both his mother and father, who gave him life in this world.",general,Bhagavad Gita
14,14.5,सत्त्वं रजस्तम इति गुणाः प्रकृतिसंभवाः । निबध्नन्ति महाबाहो देहे देहिनमव्ययम् ॥ १४.५ ॥,"हे अर्जुन ! सत्वगुण, रजोगुण, और तमोगुण —-ये प्रकृति से उत्पन्न तीनों गुण अविनाशी जीवात्मा को शरीर में बांधते हैं|","Arjuna, that NATURE is made of three parts, namely: SATTVA (the light representing goodness); RAJAS (fire representing passion), and TAMAS (darkness representing evil). These bind down and limit the human mortal bodies from reaching true perfection and achieving the state of infinite Spirit and immortality.","Arjuna, that NATURE is made of three parts, namely: SATTVA (the light representing goodness); RAJAS (fire representing passion), and TAMAS (darkness representing evil). These bind down and limit the human mortal bodies from reaching true perfection and achieving the state of infinite Spirit and immortality.",general,Bhagavad Gita
14,14.6,तत्र सत्त्वं निर्मलत्वात्प्रकाशकमनामयम् । सुखसङ्गेन बध्नाति ज्ञानसङ्गेन चानघ ॥ १४.६ ॥,"हे निष्पाप ! उन तीनों गुणों में सत्वगुण तो निर्मल होने के कारण प्रकाश करने वाला और विकार रहित है, वह सुख के सम्बन्ध से और ज्ञान के सम्बन्ध से अर्थात् उसके अभिमान से बांधता है |","Arjuna, understand these three natural elements: SATTVA, because it represents light and purity is a sign of good health, but binds the various beings in this world to worldly material happiness. This attachment also leads to lower knowledge, my friend.","Arjuna, understand these three natural elements: SATTVA, because it represents light and purity is a sign of good health, but binds the various beings in this world to worldly material happiness. This attachment also leads to lower knowledge, my friend.",motivation,Bhagavad Gita
14,14.7,रजो रागात्मकं विद्धि तृष्णासङ्गसमुद्भवम् । तन्निबध्नाति कौन्तेय कर्मसङ्गेन देहिनम् ॥ १४.७ ॥,हे अर्जुन ! राग रूप रजोगुण को कामना और आसक्ति से उत्पन्न जान । वह इस जीवात्मा को कर्मो के और उनके फल के सम्बन्ध से बांधता है |,"RAJAS, dear Arjuna, is that natural element representing passion which leads to material and worldly attachment. Rajas is known to bind the Soul of mortal men to action.","RAJAS, dear Arjuna, is that natural element representing passion which leads to material and worldly attachment. Rajas is known to bind the Soul of mortal men to action.",stress,Bhagavad Gita
14,14.8,तमस्त्वज्ञानजं विद्धि मोहनं सर्वदेहिनाम् । प्रमादालस्यनिद्राभिस्तन्निबध्नाति भारत ॥ १४.८ ॥,"हे अर्जुन सब देहाभिमानियों को मोहित करने वाले तमोगुण को तो अज्ञान से उत्पन्न जान । वह इस जीवात्मा को प्रमाद, आलस्य और निद्रा के द्वारा बांधता है|","But you should also know O Arjuna, that darkness and evil born out of the TAMAS GUNA, exists mainly because of the ignorance of man in this world. TAMAS creates laziness and dullness. One loses the value of time and no longer desires to work or to take part in constuctive action.","But you should also know O Arjuna, that darkness and evil born out of the TAMAS GUNA, exists mainly because of the ignorance of man in this world. TAMAS creates laziness and dullness. One loses the value of time and no longer desires to work or to take part in constuctive action.",stress,Bhagavad Gita
14,14.9,सत्त्वं सुखे संजयति रजः कर्मणि भारत । ज्ञानमावृत्य तु तमः प्रमादे संजयत्युत ॥ १४.९ ॥,हे अर्जुन ! सत्वगुण सुख में लगाता है और रजोगुण कर्म में तथा तमोगुण तो ज्ञान को ढककर प्रमाद में भी लगाता है |,"In reality O son of Kunti, SATTVA (or Goodness) binds one to happiness; RAJAS leads to attachment to action; and TAMAS (evil) leads one to be lazy, dull, unproductive and cause negligence due to one’s ignorance.","In reality O son of Kunti, SATTVA (or Goodness) binds one to happiness; RAJAS leads to attachment to action; and TAMAS (evil) leads one to be lazy, dull, unproductive and cause negligence due to one’s ignorance.",stress,Bhagavad Gita
14,14.11,सर्वद्वारेषु देहेऽस्मिन्प्रकाश उपजायते । ज्ञानं यदा तदा विद्याद्विवृद्धं सत्त्वमित्युत ॥ १४.११ ॥,"जिस समय इस देह में तथा अन्त:करण और इन्द्रियों में चेतनता और विवेक शक्त्ति उत्पन्न होती है, उस समय ऐसा जानना चाहिये कि सत्वगुण बढ़ा है|","When the light of true knowledge and wisdom sorrounds and comes forth from one’s body, it is a sign that the SATTVA state of nature has occupied the body and taken over the person’s body, evidenced by his good actions (therefore he is known as a SATTVIC person).","When the light of true knowledge and wisdom sorrounds and comes forth from one’s body, it is a sign that the SATTVA state of nature has occupied the body and taken over the person’s body, evidenced by his good actions (therefore he is known as a SATTVIC person).",stress,Bhagavad Gita
14,14.12,लोभः प्रवृत्तिरारम्भः कर्मणामशमः स्पृहा । रजस्येतानि जायन्ते विवृद्धे भरतर्षभ ॥ १४.१२ ॥,"हे अर्जुन ! रजोगुण के बढ़ने पर लोभ, प्रवृत्ति, स्वार्थ बुद्भि से कर्मों का सकाम भाव से आरम्भ, अशान्ति और विषय भोगों की लालसा ——ये सब उत्पन्न होते हैं |","When the RAJAS GUNA has taken over a being, then it can be seen through a person’s excessive greed, lust, unrest, activity and other similar action (therefore the person is known to be RAJAS).","When the RAJAS GUNA has taken over a being, then it can be seen through a person’s excessive greed, lust, unrest, activity and other similar action (therefore the person is known to be RAJAS).",stress,Bhagavad Gita
14,14.13,अप्रकाशोऽप्रवृत्तिश्च प्रमादो मोह एव च । तमस्येतानि जायन्ते विवृद्धे कुरुनन्दन ॥ १४.१३ ॥,"हे अर्जुन ! तमोगुण के बढ़ने पर अन्त:करण और इन्द्रियों में अप्रकाश, कर्तव्य कर्मों में अप्रवृति और प्रमाद अर्थात् व्यर्थ चेष्टा और निद्रादि, अन्त:करण की मोहिनी वृतियाँ — ये सब ही उत्पन्न होते हैं |","Dullness, inactivity, laziness, negligence, ignorance, and sheer delusion about the world are all signs that the TAMAS elements have taken control of the person’s actions, behaviour, and thinking.","Dullness, inactivity, laziness, negligence, ignorance, and sheer delusion about the world are all signs that the TAMAS elements have taken control of the person’s actions, behaviour, and thinking.",stress,Bhagavad Gita
14,14.14,यदा सत्त्वे प्रवृद्धे तु प्रलयं याति देहभृत् । तदोत्तमविदां लोकानमलान्प्रतिपद्यते ॥ १४.१४ ॥,"जब यह गुण सत्वगुण की वृद्भि में मृत्यु को प्राप्त होता है, तब तो उत्तम कार्य करने वालों के निर्मल दिव्य स्वर्गादि लोकों को प्राप्त होता है|","If a being is SATTVIC at the time that his soul departs from his body, his soul goes to the purest regions of the universe where truth and goodness prevail. He is therefore reborn at these same, pure regions of the earth O Arjuna.","If a being is SATTVIC at the time that his soul departs from his body, his soul goes to the purest regions of the universe where truth and goodness prevail. He is therefore reborn at these same, pure regions of the earth O Arjuna.",general,Bhagavad Gita
14,14.15,रजसि प्रलयं गत्वा कर्मसङ्गिषु जायते । तथा प्रलीनस्तमसि मूढयोनिषु जायते ॥ १४.१५ ॥,"रजोगुण के बढ़ने पर मृत्यु को प्राप्त होकर कर्मों की आसक्ति वाले मनुष्यों में उत्पन्न होता है ; तथा तमोगुण के बढ़ने पर मरा हुआ मनुष्य कीट, पशु आदि मूढ़ योनियों में उत्पन्न होता है ।","Should a person be in the RAJAS state at the time of death, he is reborn in the places of the world where he is restless and constantly active. Similarly if a person is TAMASIC at the time of his death, he is reborn into a family of irrational behaviour, laziness and dullness.","Should a person be in the RAJAS state at the time of death, he is reborn in the places of the world where he is restless and constantly active. Similarly if a person is TAMASIC at the time of his death, he is reborn into a family of irrational behaviour, laziness and dullness.",general,Bhagavad Gita
14,14.16,कर्मणः सुकृतस्याहुः सात्त्विकं निर्मलं फलम् । रजसस्तु फलं दुःखमज्ञानं तमसः फलम् ॥ १४.१६ ॥,"श्रेष्ठ कर्म का तो सात्विक अर्थात् सुख, ज्ञान और वैराग्यादि निर्मल फल कहा है ; राजस कर्म का फल दुःख एवं तामस कर्म का फल अज्ञान कहा है ।","The purity of SATTVA is characterized by the rewards that come out of good actions. However, the fruits of work that is done in the RAJAS state brings nothing but pain to a person; and work that is done in the TAMAS state, bears fruits of dullness and ignorance.","The purity of SATTVA is characterized by the rewards that come out of good actions. However, the fruits of work that is done in the RAJAS state brings nothing but pain to a person; and work that is done in the TAMAS state, bears fruits of dullness and ignorance.",stress,Bhagavad Gita
14,14.17,सत्त्वात्संजायते ज्ञानं रजसो लोभ एव च । प्रमादमोहौ तमसो भवतोऽज्ञानमेव च ॥ १४.१७ ॥,सत्वगुण से ज्ञान उत्पन्न होता है और रजोगुण से निस्संदेह लोभ तथा तमोगुण से प्रमाद और मोह उत्पन्न होते है और अज्ञान भी होता है ।,"From the SATTVIC state of human nature one receives wisdom, from the RAJAS state arises greed, and form TAMAS evolves dullness and ignorance.","From the SATTVIC state of human nature one receives wisdom, from the RAJAS state arises greed, and form TAMAS evolves dullness and ignorance.",motivation,Bhagavad Gita
14,14.18,ऊर्ध्वं गच्छन्ति सत्त्वस्था मध्ये तिष्ठन्ति राजसाः । जघन्यगुणवृत्तिस्था अधो गच्छन्ति तामसाः ॥ १४.१८...,"सत्वगुण में स्थित पुरुष स्वर्गादि उच्च लोकों को जाते हैं ; रजोगुण में स्थित राजस पुरुष मध्य में अर्थात् मनुष्य लोक में ही रहते हैं और तमोगुण के कार्य रूप निद्रा, प्रमाद और आलस्यादि में स्थित तामस पुरुष अधोगति अर्थात् कीट, पशु आदि नीच योनियों को तथा नरकों को प्राप्त होते हैं ।","Those who are in the SATTVA state always follow the highest path or level of wisdom and intelligence; those who are in the RAJAS state always follow the middle level of intelligence and wisdom; and those who are under the influence of TAMAS from of human nature, always stoop to the lowest level of wisdom and knowledge and continually sink downwards along this path of ignorance.","Those who are in the SATTVA state always follow the highest path or level of wisdom and intelligence; those who are in the RAJAS state always follow the middle level of intelligence and wisdom; and those who are under the influence of TAMAS from of human nature, always stoop to the lowest level of wisdom and knowledge and continually sink downwards along this path of ignorance.",confusion,Bhagavad Gita
14,14.19,नान्यं गुणेभ्यः कर्तारं यदा द्रष्टानुपश्यति । गुणेभ्यश्च परं वेत्ति मद्भावं सोऽधिगच्छति ॥ १४.१९ ॥,"जिस समय द्रष्टा तीनों गुणों के अतिरिक्त अन्य किसी को कर्ता नहीं देखता और तीनो गुणों से अत्यन्त परे सच्चिदानन्धन स्वरूप मुझ परमात्मा को तत्व से जानता है, उस समय वह मेरे स्वरूप को प्राप्त होता है ।","When a true wiseman and seer fully understands that these three parts of nature are virtually the three main stages of life in this vast universe, he begins to also realize that which lies beyond these three conditions of nature, that is Myself. Thus once this is realized by any being they become an eternal part of Me the SUPREME LORD.","When a true wiseman and seer fully understands that these three parts of nature are virtually the three main stages of life in this vast universe, he begins to also realize that which lies beyond these three conditions of nature, that is Myself. Thus once this is realized by any being they become an eternal part of Me the SUPREME LORD.",motivation,Bhagavad Gita
