chapter,verse,sanskrit,hindi,english,explanation,emotion,source
4,4.29,अपाने जुह्वति प्राणं प्राणेऽपानं तथापरे प्राणापानगती रुद्ध्वा प्राणायामपरायणाः अपरे नियताहाराः प्र...,"दूसरे कितने ही योगीजन अपानवायुमें प्राणवायुको हवन करते हैं, वैसे ही अन्य योगीजन प्राणवायुमें अपानवायुको हवन करते हैं तथा अन्य कितने ही नियमित आहार करनेवाले प्राणायामपरायण पुरुष प्राण और अपानकी गतिको रोककर प्राणोंको प्राणोंमें ही हवन किया करते हैं। ये सभी साधक यज्ञोंद्वारा पापोंका नाश कर देनेवाले और यज्ञोंको जाननेवाले हैं|","Other Yogis (wise men) perform sacrifice by controlling the amount of breaths they take. By holding in their breath for a long periond of time whilepronouncing My name, they increase their life’s longevity. This act is known as PRANAYAM.Others perform sacrifice by controlling what they eat,(fasting). Those whose sins have been destroyed by sacrifice, understand the power and importance of sacrifice.","Other Yogis (wise men) perform sacrifice by controlling the amount of breaths they take. By holding in their breath for a long periond of time whilepronouncing My name, they increase their life’s longevity. This act is known as PRANAYAM.Others perform sacrifice by controlling what they eat,(fasting). Those whose sins have been destroyed by sacrifice, understand the power and importance of sacrifice.",stress,Bhagavad Gita
4,4.31,नायं लोकोऽस्त्ययज्ञस्य कुतोऽन्यः कुरुसत्तम ॥ ४.३१ ॥,"हे कुरुश्रेष्ठ अर्जुन! यज्ञसे बचे हुए अमृतका अनुभव करनेवाले योगीजन सनातन परब्रह्म परमात्माको प्राप्त होते हैं। और यज्ञ न करनेवाले पुरुषके लिये तो यह मनुष्यलोक भी सुखदायक नहीं है, फिर परलोक है कैसे सुखदायक हो सकता है ?","O Arjuna, only those people who have sacrificed to achieve wisdom and knowledge of Gyan, go to Brahma, (the creator of all beings and God of Wisdom in the World). Without performing some sort of sacrifice in life, one cannot possibly remain happy in this world, not to mention the afterworl","O Arjuna, only those people who have sacrificed to achieve wisdom and knowledge of Gyan, go to Brahma, (the creator of all beings and God of Wisdom in the World). Without performing some sort of sacrifice in life, one cannot possibly remain happy in this world, not to mention the afterworl",stress,Bhagavad Gita
4,4.32,एवं बहुविधा यज्ञा वितता ब्रह्मणो मुखे । कर्मजान्विद्धि तान्सर्वानेवं ज्ञात्वा विमोक्ष्यसे ॥ ४.३२ ॥,"इसी प्रकार और भी बहुत तरहके यज्ञ वेदकी वाणीमें विस्तारसे कहे गये हैं। उन सबको तू मन, इन्द्रिय और शरीरकी क्रियाद्वारा सम्पन्न होनेवाले जान, इस प्रकार तत्त्वसे जानकर उनके अनुष्ठानद्वारा तू कर्मबन्धनसे सर्वथा मुक्त हो जायगा|","The Lord continued:O Arjuna, many sacrifices are mentioned extensively throughout the Vedas. All of these sacrifices involve some sort of action or Karma to be performed. With this knowledge in mind, you will achieve the state of unattached Karma, or action done without the expectation of any results.","The Lord continued:O Arjuna, many sacrifices are mentioned extensively throughout the Vedas. All of these sacrifices involve some sort of action or Karma to be performed. With this knowledge in mind, you will achieve the state of unattached Karma, or action done without the expectation of any results.",stress,Bhagavad Gita
4,4.33,श्रेयान्द्रव्यमयाद्यज्ञाज्ज्ञानयज्ञः परन्तप । सर्वं कर्माखिलं पार्थ ज्ञाने परिसमाप्यते ॥ ४.३३ ॥,"हे परंतप अर्जुन ! द्रव्यमय यज्ञकी अपेक्षा ज्ञानयज्ञ अत्यन्त श्रेष्ठ है, तथा यावन्मात्र सम्पूर्ण कर्म ज्ञानमें समाप्त हो जाते हैं|","O Arjuna, sacrifice of wisdom (Gyan) is always better than sacrifice of material objects because all actions end with Gyan.","O Arjuna, sacrifice of wisdom (Gyan) is always better than sacrifice of material objects because all actions end with Gyan.",stress,Bhagavad Gita
4,4.34,तद्विद्धि प्रणिपातेन परिप्रश्नेन सेवया । उपदेक्ष्यन्ति ते ज्ञानं ज्ञानिनस्तत्त्वदर्शिनः ॥ ४.३४ ॥,"उस ज्ञानको तू तत्त्वदर्शी ज्ञानियोंके पास जाकर समझ, उनको भलीभाँति दण्डवत् प्रणाम करनेसे, उनकी सेवा करनेसे और कपट छोड़कर सरलतापूर्वक प्रश्न करनेसे वे परमात्मतत्त्वको भलीभाँति जाननेवाले ज्ञानी महात्मा तुझे उस तत्त्वज्ञानका उपदेश करेंगे|","The Lord advised:O Arjuna, learn the principles of Gyan and ask questions about Gyan respectfully and with determination, from those who fully understand the principles of Gyan. Thay will explain “Gyan” to you. Knowing Gyan, you will never be in the confused state as you are in now.","The Lord advised:O Arjuna, learn the principles of Gyan and ask questions about Gyan respectfully and with determination, from those who fully understand the principles of Gyan. Thay will explain “Gyan” to you. Knowing Gyan, you will never be in the confused state as you are in now.",motivation,Bhagavad Gita
4,4.35,यज्ज्ञात्वा न पुनर्मोहमेवं यास्यसि पाण्डव । येन भूतान्यशेषेण द्रक्ष्यस्यात्मन्यथो मयि ॥ ४.३५ ॥,जिसको जानकर फिर तू इस प्रकार मोहको नहीं प्राप्त होगा तथा हे अर्जुन ! जिस ज्ञानके द्वारा तू सम्पूर्ण भूतोंको नि:शेषभावसे पहले अपनेमें’ और पीछे मुझ सच्चिदानन्दघन परमात्मामें देखेगा|,"The Lord continued:O Arjuna, through Gyan, you will see all beings within yourself, and thereafter, all beings in Me.","The Lord continued:O Arjuna, through Gyan, you will see all beings within yourself, and thereafter, all beings in Me.",general,Bhagavad Gita
4,4.36,अपि चेदसि पापेभ्यः सर्वेभ्यः पापकृत्तमः । सर्वं ज्ञानप्लवेनैव वृजिनं सन्तरिष्यसि ॥ ४.३६ ॥,यदि तू अन्य सब पापियोंसे भी अधिक पाप करनेवाला है; तो भी तू ज्ञानरूप नौकाद्वारा नि:संदेह तू सम्पूर्ण पाप-समुद्रसे भलीभाँति तर जायगा|,"O Arjuna, even if you are the greatest sinner in the world, this river of sins can be crossed with the boat of Gyan.","O Arjuna, even if you are the greatest sinner in the world, this river of sins can be crossed with the boat of Gyan.",general,Bhagavad Gita
4,4.37,यथैधांसि समिद्धोऽग्निर्भस्मसात्कुरुतेऽर्जुन । ज्ञानाग्निः सर्वकर्माणि भस्मसात्कुरुते तथा ॥ ४.३७ ॥,"क्योंकि हे अर्जुन ! जैसे प्रज्वलित अग्नि ईंधनोंको भस्ममय कर देता है, वैसे ही ज्ञानरूप अग्नि सम्पूर्ण कर्मोंको भस्ममय कर देता है|","O Arjuna, as the burnig fire reduces fuel to ashes, in this same way, Karma (attached Karma binding a person to the material world), is burnt down with the fire of Gyan.","O Arjuna, as the burnig fire reduces fuel to ashes, in this same way, Karma (attached Karma binding a person to the material world), is burnt down with the fire of Gyan.",stress,Bhagavad Gita
4,4.38,न हि ज्ञानेन सदृशं पवित्रमिह विद्यते । तत्स्वयं योगसंसिद्धः कालेनात्मनि विन्दति ॥ ४.३८ ॥,इस संसारमें ज्ञानके समान पवित्र करनेवाला निःसंदेह कुछ भी नहीं है । उस ज्ञानको कितने ही कालसे कर्मयोगके द्वारा शुद्धान्तःकरण हुआ मनुष्य अपने आप ही आत्मामें पा लेता है|,"In this world, O Arjuna, there is no greater purifier than Gyan or wisdom itself. The person who has mastered Yoga to perfection feels wisdom in his soul at the proper time.","In this world, O Arjuna, there is no greater purifier than Gyan or wisdom itself. The person who has mastered Yoga to perfection feels wisdom in his soul at the proper time.",general,Bhagavad Gita
4,4.39,श्रद्धावाँल्लभते ज्ञानं तत्परः संयतेन्द्रियः । ज्ञानं लब्ध्वा परां शान्तिमचिरेणाधिगच्छति ॥ ४.३९ ॥,"जितेन्द्रिय, साधनपरायण और श्रद्धावान् मनुष्य ज्ञानको प्राप्त होता है तथा ज्ञानको प्राप्त होकर वह बिना विलम्बके – तत्काल ही भगवत्प्राप्तिरूप परम – शान्तिको प्राप्त हो जाता है|","To abtain Gyan, one must conquer the senses, and develop a real devotion and faith towards the Lord. When one obtains Gyan, he has discovered the key to Supreme peace.","To abtain Gyan, one must conquer the senses, and develop a real devotion and faith towards the Lord. When one obtains Gyan, he has discovered the key to Supreme peace.",happiness,Bhagavad Gita
4,4.41,योगसंन्यस्तकर्माणं ज्ञानसंछिन्नसंशयम् । आत्मवन्तं न कर्माणि निबध्नन्ति धनंजय ॥ ४.४१ ॥,"हे धनञ्जय ! जिसने कर्मयोगकी विधिसे समस्त कर्मोंका परमात्मामें अर्पण कर दिया है और जिसने विवेकद्वारा समस्त संशयोंका नाश कर दिया है, ऐसे वशमें किये हुए अन्तःकरणवाले पुरुषको कर्म नहीं बाँधते|","One who has rid himself of attached Karma by practising Yoga and one who has rid himself of doubts by achieving Gyan, he is a self-realized person and is not bound by attached Karma.","One who has rid himself of attached Karma by practising Yoga and one who has rid himself of doubts by achieving Gyan, he is a self-realized person and is not bound by attached Karma.",stress,Bhagavad Gita
4,4.42,तस्मादज्ञानसम्भूतं हृत्स्थं ज्ञानासिनात्मनः । छित्त्वैनं संशयं योगमातिष्ठोत्तिष्ठ भारत ॥ ४.४२ ॥,इसलिये हे भरतवंशी अर्जुन ! तू हृदयमें स्थित इस अज्ञानजनित अपने संशयका विवेकज्ञानरूप तलवारद्वारा छेदन करके समत्वरूप कर्मयोगमें स्थित हो जा और युद्धके लिये खड़ा हो जा|,"Hence, be established in yoga by cutting the ignorance born doubt about the self with the sword of knowledge. Stand up, O Bharata.","Hence, be established in yoga by cutting the ignorance born doubt about the self with the sword of knowledge. Stand up, O Bharata.",anxiety,Bhagavad Gita
5,5.1,अर्जुन उवाच । संन्यासं कर्मणां कृष्ण पुनर्योगं च शंससि यच्छ्रेय एतयोरेकं तन्मे ब्रूहि सुनिश्चितम् ...,"अर्जुन बोले– हे कृष्ण ! आप कर्मोंके संन्यासकी और फिर कर्मयोगकी प्रशंसा करते हैं । इसलिये इन दोनोंमेंसे जो एक मेरे लिये भलीभाँति निश्चित कल्याणकारक साधन हो, उसको कहिये|","Arjuna asked the Great Lord: Dear Krishna, I am still confused. I have heard praise of Yoga as well as of Sannyaas (Holy Pilgrimage), from You. Which one of these two O Lord, is the best path for me?","Arjuna asked the Great Lord: Dear Krishna, I am still confused. I have heard praise of Yoga as well as of Sannyaas (Holy Pilgrimage), from You. Which one of these two O Lord, is the best path for me?",confusion,Bhagavad Gita
5,5.2,श्रीभगवानुवाच । संन्यासः कर्मयोगश्च निःश्रेयसकरावुभौ तयोस्तु कर्मसंन्यासात्कर्मयोगो विशिष्यते ॥ ५....,"श्रीभगवान् बोले- कर्मसंन्यास और कर्मयोग— ये दोनों ही परम कल्याणके करनेवाले हैं, परन्तु उन दोनोंमें भी कर्मसंन्याससे कर्मयोग साधनमें सुगम होनेसे श्रेष्ठ है|","Oh Arjuna, both the paths of Yoga and Sannyaas lead one to supreme bliss and happiness. However, I shall always regard Yoga as the better path to the attainment of supreme peace and unity with Me, than the path of Sannyaas.","Oh Arjuna, both the paths of Yoga and Sannyaas lead one to supreme bliss and happiness. However, I shall always regard Yoga as the better path to the attainment of supreme peace and unity with Me, than the path of Sannyaas.",confusion,Bhagavad Gita
5,5.3,ज्ञेयः स नित्यसंन्यासी यो न द्वेष्टि न काङ्क्षति । निर्द्वन्द्वो हि महाबाहो सुखं बन्धात्प्रमुच्यते ...,"हे अर्जुन! जो पुरुष न किसीसे द्वेष करता है और न किसीकी आकांक्षा करता है, वह कर्मयोगी सदा संन्यासी ही समझने योग्य है; क्योंकि राग द्वेषादि द्वन्द्वोंसे रहित पुरुष सुखपूर्वक संसारबन्धनसे मुक्त हो जाता है|","Oh Arjuna a true Sannyaasi is one who has no doubts about anything he does or encounters in his life; who has no enemies whatsoever, and above all, who is free from all desires (for material objects). If he has accomplished all these bondages of the world.","Oh Arjuna a true Sannyaasi is one who has no doubts about anything he does or encounters in his life; who has no enemies whatsoever, and above all, who is free from all desires (for material objects). If he has accomplished all these bondages of the world.",anxiety,Bhagavad Gita
5,5.4,सांख्ययोगौ पृथग्बालाः प्रवदन्ति न पण्डिताः । एकमप्यास्थितः सम्यगुभयोर्विन्दते फलम् ॥ ५.४ ॥,"उपर्युक्त संन्यास और कर्मयोगको मूर्खलोग पृथक् पृथक् फल देनेवाले कहते हैं न कि पण्डितजन, क्योंकि दोनोंमेंसे एकमें भी सम्यक् प्रकारसे स्थित पुरुष दोनोंके फलरूप परमात्माको प्राप्त होता है|","Oh Arjuna, in essense, Yoga and Sannyaas are the same because both of these achieve the same goal. Those who consider Yoga and Sannyaas as two different paths leading to the achievement of two different goals, are ignorant.When one is fully absorbed and established in either one of Yoga or Sannyaas, he achieves the results of both of these sacred institutions.","Oh Arjuna, in essense, Yoga and Sannyaas are the same because both of these achieve the same goal. Those who consider Yoga and Sannyaas as two different paths leading to the achievement of two different goals, are ignorant.When one is fully absorbed and established in either one of Yoga or Sannyaas, he achieves the results of both of these sacred institutions.",stress,Bhagavad Gita
5,5.5,यत्सांख्यैः प्राप्यते स्थानं तद्योगैरपि गम्यते । एकं सांख्यं च योगं च यः पश्यति स: पश्यति ॥ ५.५ ॥,"ज्ञानयोगियों द्वारा जो परमधाम प्राप्त किया जाता है, कर्मयोगियों द्वारा भी वही प्राप्त किया जाता है। इसलिये जो पुरुष ज्ञानयोग और कर्मयोगको फलरूपमें एक देखता है, वही यथार्थ देखता है|","Yoga or Sannyaas (together known as Sankyoga) both attain the same goal for he who follows either of these paths. Only he who considers Yoga and Sannyaas as one, sees the ultimate Truth (the Lord).","Yoga or Sannyaas (together known as Sankyoga) both attain the same goal for he who follows either of these paths. Only he who considers Yoga and Sannyaas as one, sees the ultimate Truth (the Lord).",confusion,Bhagavad Gita
5,5.6,संन्यासस्तु महाबाहो दुःखमाप्तुमयोगतः । योगयुक्तो मुनिर्ब्रह्म नचिरेणाधिगच्छति ॥ ५.६ ॥,"परन्तु हे अर्जुन ! कर्मयोगके बिना संन्यास अर्थात् मन, इन्द्रिय और शरीरद्वारा होनेवाले सम्पूर्ण कर्मोंमें कर्तापनका त्याग प्राप्त होना कठिन है और भगवत्स्वरूपको मनन करनेवाला कर्मयोगी परब्रह्म परमात्माको शीघ्र ही प्राप्त हो जाता है|","The Blessed Lord spoke in His Divine voice:O my dear Arjuna, in order for one to achieve Sannyaas, he must practise Karmyoga (doing Karma or actions without attachment or desire to see the results of those actions). If one is successful in performing Karmyoga (that is Karma without attachment to results), he shall realize God very quickly.","The Blessed Lord spoke in His Divine voice:O my dear Arjuna, in order for one to achieve Sannyaas, he must practise Karmyoga (doing Karma or actions without attachment or desire to see the results of those actions). If one is successful in performing Karmyoga (that is Karma without attachment to results), he shall realize God very quickly.",stress,Bhagavad Gita
5,5.7,योगयुक्तो विशुद्धात्मा विजितात्मा जितेन्द्रियः । सर्वभूतात्मभूतात्मा कुर्वन्नपि न लिप्यते ॥ ५.७ ॥,"जिसका मन अपने वशमें है, जो जितेन्द्रिय एवं विशुद्ध अन्तःकरणवाला है और सम्पूर्ण प्राणियोंका आत्मरूप परमात्मा ही जिसका आत्मा है, ऐसा कर्मयोगी कर्म करता हुआ भी लिप्त नहीं होता|","The Lord spoke onwards:The Karmyogi is a purified being who has conquered the self. He does not centre his life around himeself but around the achievement of being one with God.He detaches himeself from his senses, centering all his thoughts on God and achieving everlasting peace and happiness by breaking free of all material bondage to the world.","The Lord spoke onwards:The Karmyogi is a purified being who has conquered the self. He does not centre his life around himeself but around the achievement of being one with God.He detaches himeself from his senses, centering all his thoughts on God and achieving everlasting peace and happiness by breaking free of all material bondage to the world.",happiness,Bhagavad Gita
5,5.8,नैव किंचित्करोमीति युक्तो मन्येत तत्त्ववित् । पश्यञ्श्रृण्वन्स्पृशञ्जिघ्रन्नश्नन्\u200cगच्छन्स्वपञ्...,"तत्त्वको जाननेवाला सांख्ययोगी तो देखता हुआ, सुनता हुआ, स्पर्श करता हुआ, सूँघता हुआ, भोजन करता हुआ, गमन करता हुआ, सोता हुआ, श्वास लेता हुआ, बोलता हुआ, त्यागता हुआ, ग्रहण करता हुआ तथा आँखोंको खोलता और मूँदता हुआ भी, सब इन्द्रियाँ अपने-अपने अर्थोंमें बरत रही हैं – इस प्रकार समझकर निःसन्देह ऐसा माने कि मैं कुछ भी नहीं करता हूँ|","He who comes to the realization that, although he is physically performing actions such as seeing, hearing, touching, smelling, eating, walking, sleeping, breathing, speaking, receiving, sacrificing, opening and closing eyes, and so on, that he is actually doing nothing, is a Yogi. O Arjuna, the truly wise Yogi knows that in reality, only the senses are acting among their sense objects.","He who comes to the realization that, although he is physically performing actions such as seeing, hearing, touching, smelling, eating, walking, sleeping, breathing, speaking, receiving, sacrificing, opening and closing eyes, and so on, that he is actually doing nothing, is a Yogi. O Arjuna, the truly wise Yogi knows that in reality, only the senses are acting among their sense objects.",stress,Bhagavad Gita
