chapter,verse,sanskrit,hindi,english,explanation,emotion,source
9,9.17,पिताहमस्य जगतो माता धाता पितामहः । वेद्यं पवित्रमोंकार ऋक्साम यजुरेव च ॥ ९.१७ ॥,"इस सम्पूर्ण जगत्का धाता अर्थात् धारण करनेवाला एवं कर्मोंके फलको देनेवाला, पिता, माता, पितामह, जाननेयोग्य,’ पवित्र ओंकार तथा ऋग्वेद, सामवेद और यजुर्वेद भी मैं ही हूँ|","I am the sustainer, the father,mother, and grandfather of the whole universe. I represent all that is knowable and worth knowing
I am the Supreme Purifier of all things in the Universe and I represent all of the Vedas in the Universe also, namely, Rig Veda, Yajur Veda and Sama Veda.","I am the sustainer, the father,mother, and grandfather of the whole universe. I represent all that is knowable and worth knowing
I am the Supreme Purifier of all things in the Universe and I represent all of the Vedas in the Universe also, namely, Rig Veda, Yajur Veda and Sama Veda.",general,Bhagavad Gita
9,9.18,गतिर्भर्ता प्रभुः साक्षी निवासः शरणं सुहृत् । प्रभवः प्रलयः स्थानं निधानं बीजमव्ययम् ॥ ९.१८ ॥,"प्राप्त होनेयोग्य परम धाम, भरण-पोषण करनेवाला, सबका स्वामी, शुभाशुभका देखनेवाला, सबका वासस्थान, शरण लेनेयोग्य, प्रत्युपकार न चाहकर हित करनेवाला, सबकी उत्पत्ति प्रलयका हेतु, – स्थितिका आधार, निधान’ और अविनाशी कारण भी मैं ही हूँ|","O Dear Arjuna, I support and preserve all the creation in the universe; I am the Supreme Lord of all; the witness of all occurrences, the shelter; the refuge; the well-wisher of all beings; the absolute beginning and origin of things, and the absolute end termination of all things.
Furthermore, Arjuna, I am the resting place and storage place (refuge) into which all beings come together when the time of universal destruction is at hand. Know Me also, as the one imperishable, indestructible seed from which all beings in the universe are cultivated.","O Dear Arjuna, I support and preserve all the creation in the universe; I am the Supreme Lord of all; the witness of all occurrences, the shelter; the refuge; the well-wisher of all beings; the absolute beginning and origin of things, and the absolute end termination of all things.
Furthermore, Arjuna, I am the resting place and storage place (refuge) into which all beings come together when the time of universal destruction is at hand. Know Me also, as the one imperishable, indestructible seed from which all beings in the universe are cultivated.",general,Bhagavad Gita
9,9.19,तपाम्यहमहं वर्षं निगृह्णाम्युत्सृजामि च । अमृतं चैव मृत्युश्च सदसच्चाहमर्जुन ॥ ९.१९ ॥,"मैं ही सूर्यरूपसे तपता हूँ, वर्षाका आकर्षण करता हूँ और उसे बरसाता हूँ। हे अर्जुन ! मैं ही अमृत और मृत्यु हूँ और सत् असत् भी मैं – ही हूँ|","O Arjuna, I am the giver of heat; I am responsible also, for the sending and holding back of rain for the nourishment of all life.
You must understand, My dear friend, that I am the very nectar (the juice) of life within all beings, and at the same time, I am the death of all beings. Arjuna, I am all that is real and unreal in this universe.","O Arjuna, I am the giver of heat; I am responsible also, for the sending and holding back of rain for the nourishment of all life.
You must understand, My dear friend, that I am the very nectar (the juice) of life within all beings, and at the same time, I am the death of all beings. Arjuna, I am all that is real and unreal in this universe.",motivation,Bhagavad Gita
9,9.21,ते तं भुक्त्वा स्वर्गलोकं विशालं क्षीणे पुण्ये मर्त्यलोकं विशन्ति । एवं त्रयीधर्ममनुप्रपन्ना गताग...,"वे उस विशाल स्वर्गलोकको भोगकर पुण्य क्षीण होनेपर मृत्युलोकको प्राप्त होते हैं। इस प्रकार स्वर्गके साधनरूप तीनों वेदोंमें कहे हुए सकामकर्मका आश्रय लेनेवाले और भोगोंकी कामनावाले पुरुष बार बार आवागमनको प्राप्त – होते हैं, अर्थात् पुण्यके प्रभावसे स्वर्गमें जाते हैं और पुण्य क्षीण होनेपर मृत्युलोकमें आते हैं|","However, Arjuna, after all of their good Karma (action) has expired, the enjoyment of all of the happiness, joy and peace that they have encountered in heaven ends as well, and therefore, they are reborn in the world (subject to the cycle of birth and death) once more.
Therefore, Arjuna, all beings who perform attached Karma (actions performed for the purpose of gaining something, i.e. fruits, in return for the action), are always born and reborn into this cycle of birth and death according to the three Vedas.","However, Arjuna, after all of their good Karma (action) has expired, the enjoyment of all of the happiness, joy and peace that they have encountered in heaven ends as well, and therefore, they are reborn in the world (subject to the cycle of birth and death) once more.
Therefore, Arjuna, all beings who perform attached Karma (actions performed for the purpose of gaining something, i.e. fruits, in return for the action), are always born and reborn into this cycle of birth and death according to the three Vedas.",stress,Bhagavad Gita
9,9.22,अनन्याश्चिन्तयन्तो मां ये जनाः पर्युपासते । तेषां नित्याभियुक्तानां योगक्षेमं वहाम्यहम् ॥ ९.२२ ॥,"जो अनन्यप्रेमी भक्तजन मुझ परमेश्वरको निरन्तर चिन्तन करते हुए निष्कामभावसे भजते हैं, उन नित्य-निरन्तर मेरा चिन्तन करनेवाले पुरुषोंका योगक्षेम मैं स्वयं प्राप्त कर देता हूँ|","However, Arjuna, for those beings who worship Me with a fixed mind, meditating and constantly thinking of Me, worshipping Me without any desire for rewards in return for their worship, are granted full refuge and salvation in My Supreme Abode (Heaven). These devotees are never reborn in this cycles of birth and death and attain a place in My Abode for Eternity.","However, Arjuna, for those beings who worship Me with a fixed mind, meditating and constantly thinking of Me, worshipping Me without any desire for rewards in return for their worship, are granted full refuge and salvation in My Supreme Abode (Heaven). These devotees are never reborn in this cycles of birth and death and attain a place in My Abode for Eternity.",general,Bhagavad Gita
9,9.23,येऽप्यन्यदेवताभक्ता यजन्ते श्रद्धयान्विताः । तेऽपि मामेव कौन्तेय यजन्त्यविधिपूर्वकम् ॥ ९.२३ ॥,"हे अर्जुन ! यद्यपि श्रद्धासे युक्त जो सकाम भक्त दूसरे देवताओंको पूजते हैं, वे भी मुझको ही पूजते हैं; किन्तु उनका वह पूजन अविधिपूर्वक अर्थात् अज्ञानपूर्वक है|","Arjuna, all of those devotees of mine who perform Attached Karma and who have faith in the various Deities (who are all part of and representatives of Me in reality), actually worship Me. However, this worship is really being done out ignorance, (lack of proper knowledge about Me.)","Arjuna, all of those devotees of mine who perform Attached Karma and who have faith in the various Deities (who are all part of and representatives of Me in reality), actually worship Me. However, this worship is really being done out ignorance, (lack of proper knowledge about Me.)",stress,Bhagavad Gita
9,9.24,अहं हि सर्वयज्ञानां भोक्ता च प्रभुरेव च । न तु मामभिजानन्ति तत्त्वेनातश्च्यवन्ति ते ॥ ९.२४ ॥,"क्योंकि सम्पूर्ण यज्ञोंका भोक्ता और स्वामी भी मैं ही हूँ; परन्तु वे मुझ परमेश्वरको तत्त्वसे नहीं जानते, इसीसे गिरते हैं अर्थात् पुनर्जन्मको प्राप्त होते हैं|","Arjuna, I am the Supreme Lord and receiver of all sacred sacrifices. However, those devotees who worship Me for some sort of motive or reward, really do not knows Me, and therefore, they shall always fall in this cycle of birth and death.","Arjuna, I am the Supreme Lord and receiver of all sacred sacrifices. However, those devotees who worship Me for some sort of motive or reward, really do not knows Me, and therefore, they shall always fall in this cycle of birth and death.",general,Bhagavad Gita
9,9.25,यान्ति देवव्रता देवान्पितॄन्यान्ति पितृव्रताः । भूतानि यान्ति भूतेज्या यान्ति मद्याजिनोऽपि माम् ॥ ९...,"देवताओंको पूजनेवाले देवताओंको प्राप्त होते हैं, पितरोंको पूजनेवाले पितरोंको प्राप्त होते हैं, भूतोंको पूजनेवाले भूतोंको प्राप्त होते हैं और मेरा पूजन करनेवाले भक्त मुझको ही प्राप्त होते हैं । इसलिये मेरे भक्तोंका पुनर्जन्म नहीं होता|","Arjuna, a person only gets what he worship for. Those who worship Deities, attain them. Those who worship ancestors, attain them. Those who worship the spirits, attain spirits, and of course, those who worship Me, will undoubtedly attain Me.","Arjuna, a person only gets what he worship for. Those who worship Deities, attain them. Those who worship ancestors, attain them. Those who worship the spirits, attain spirits, and of course, those who worship Me, will undoubtedly attain Me.",anxiety,Bhagavad Gita
9,9.26,पत्रं पुष्पं फलं तोयं यो मे भक्त्या प्रयच्छति । तदहं भक्त्युपहृतमश्नामि प्रयतात्मनः ॥ ९.२६ ॥,"जो कोई भक्त मेरे लिये प्रेमसे पत्र, पुष्प, फल, जल आदि अर्पण करता है, उस शुद्धबुद्धि निष्काम प्रेमी भक्तका प्रेमपूर्वक अर्पण किया हुआ वह पत्र पुष्पादि मैं सगुणरूपसे प्रकट होकर प्रीतिसहित – खाता हूँ|","I accept with love, all of the offerings that My selfless devotees present to Me (devotedly) in the form of leaves, flowers, fruits and water.","I accept with love, all of the offerings that My selfless devotees present to Me (devotedly) in the form of leaves, flowers, fruits and water.",general,Bhagavad Gita
9,9.27,यत्करोषि यदश्नासि यज्जुहोषि ददासि यत् । यत्तपस्यसि कौन्तेय तत्कुरुष्व मदर्पणम् ॥ ९.२७ ॥,"हे अर्जुन! तू जो कर्म करता है, जो खाता है, जो हवन करता है, जो दान देता है और जो तप करता है, वह सब मेरे अर्पण कर|","Arjuna, whatever you do, whatever your actions are, whatever you sacrifice and give, and whatever your religious and sacred parctices may be, offer all of these to Me, dear friend.","Arjuna, whatever you do, whatever your actions are, whatever you sacrifice and give, and whatever your religious and sacred parctices may be, offer all of these to Me, dear friend.",stress,Bhagavad Gita
9,9.28,शुभाशुभफलैरेवं मोक्ष्यसे कर्मबन्धनैः । संन्यासयोगयुक्तात्मा विमुक्तो मामुपैष्यसि ॥ ९.२८ ॥,"इस प्रकार, जिसमें समस्त कर्म मुझ भगवान्के अर्पण होते हैं – ऐसे संन्यासयोगसे युक्त चित्तवाला तू शुभाशुभ फलरूप कर्मबन्धनसे मुक्त हो जायगा और उनसे मुक्त होकर मुझको ही प्राप्त होगा|","With your mind religiously and devotedly established in Sannyaas Yoga (offering all of your actions to Me), and therefore being fully released from the bondages and ties to worldly pleasures which result from attachment to Karma (good and bad Karma), you shall ultimately, and definitely, attain Me.","With your mind religiously and devotedly established in Sannyaas Yoga (offering all of your actions to Me), and therefore being fully released from the bondages and ties to worldly pleasures which result from attachment to Karma (good and bad Karma), you shall ultimately, and definitely, attain Me.",stress,Bhagavad Gita
9,9.29,समोऽहं सर्वभूतेषु न मे द्वेष्योऽस्ति न प्रियः । ये भजन्ति तु मां भक्त्या मयि ते तेषु चाप्यहम् ॥ ९.२...,"मैं सब भूतोंमें समभावसे व्यापक हूँ, नकोई मेरा अप्रिय है और न प्रिय है; परन्तु जोभक्त मुझको प्रेमसे भजते हैं, वे मुझमें हैं और मैं भी उनमें प्रत्यक्ष प्रकट हूँ|","I regard all beings with equality and with even-mindedness. I neither hate nor love anybody, nor do I like or dislike anyone. However, those who choose to worship Me, with everlasting and pure devotion, are always in Me, and I am in them.","I regard all beings with equality and with even-mindedness. I neither hate nor love anybody, nor do I like or dislike anyone. However, those who choose to worship Me, with everlasting and pure devotion, are always in Me, and I am in them.",general,Bhagavad Gita
9,9.31,क्षिप्रं भवति धर्मात्मा शश्वच्छान्तिं निगच्छति । कौन्तेय प्रति जानीहि न मे भक्तः प्रणश्यति ॥ ९.३१ ॥,वह शीघ्र ही धर्मात्मा हो जाता है और सदा रहनेवाली परम शान्तिको प्राप्त होता है । हे अर्जुन! तू निश्चयपूर्वक सत्य जान कि मेरा भक्त नष्ट नहीं होता|,"This evil man will then soon become a very pure and pious man in time. He will then attain eternal peace and happiness, Realize this truth O Arjuna, that he who is My true devotees, shall never suffer destruction.","This evil man will then soon become a very pure and pious man in time. He will then attain eternal peace and happiness, Realize this truth O Arjuna, that he who is My true devotees, shall never suffer destruction.",happiness,Bhagavad Gita
9,9.32,मां हि पार्थ व्यपाश्रित्य येऽपि स्युः पापयोनयः । स्त्रियो वैश्यास्तथा शूद्रास्तेऽपि यान्ति परां गति...,"हे अर्जुन ! स्त्री, वैश्य, शूद्र तथा पापयोनि– चाण्डालादि जो कोई भी हों, वे भी मेरे शरण होकर परमगतिको ही प्राप्त होते हैं|","Dear Arjuna, by taking refuge in Me, (the true path to bliss and joy), a sinful person, a women, a businessman, and even an untouchable person, will attain, the Supreme state just as the virtuous Brahman, and the devoted great royal sages and wise men.","Dear Arjuna, by taking refuge in Me, (the true path to bliss and joy), a sinful person, a women, a businessman, and even an untouchable person, will attain, the Supreme state just as the virtuous Brahman, and the devoted great royal sages and wise men.",confusion,Bhagavad Gita
9,9.33,किं पुनर्ब्राह्मणाः पुण्या भक्ता राजर्षयस्तथा । अनित्यमसुखं लोकमिमं प्राप्य भजस्व माम् ॥ ९.३३ ॥,"फिर इसमें तो कहना ही क्या है, जो पुण्यशील ब्राह्मण तथा राजर्षि भक्तजन मेरी शरण होकर परमगतिको प्राप्त होते हैं । इसलिये तू सुखरहित और क्षणभङ्गुर इस मनुष्य शरीरको प्राप्त होकर निरन्तर मेरा ही भजन कर|","O Arjuna, this world is one that is quickly passing, very brief and full of sufferings. Having been born here in such a world, the only way that one can attain true happiness and peace is to worship Me.","O Arjuna, this world is one that is quickly passing, very brief and full of sufferings. Having been born here in such a world, the only way that one can attain true happiness and peace is to worship Me.",happiness,Bhagavad Gita
9,9.34,मन्मना भव मद्भक्तो मद्याजी मां नमस्कुरु । मामेवैष्यसि युक्त्वैवमात्मानं मत्परायणः ॥ ९.३४ ॥,"मुझमें मनवाला हो, मेरा भक्त बन, मेरा पूजन करनेवाला हो, मुझको प्रणाम कर । इस प्रकार आत्माको मुझमें नियुक्त करके मेरे परायण होकर तू मुझको ही प्राप्त होगा|","Arjuna, fix your mind only on Me; be my true, dedicated and sincere devotee; offer all sacrifices to Me; bow to Me. Having these things with Me always in mind, you will come to Me inevitably.","Arjuna, fix your mind only on Me; be my true, dedicated and sincere devotee; offer all sacrifices to Me; bow to Me. Having these things with Me always in mind, you will come to Me inevitably.",general,Bhagavad Gita
10,10.1,श्रीभगवानुवाच । भूय एव महाबाहो शृणु मे परमं वचः यत्तेऽहं प्रीयमाणाय वक्ष्यामि हितकाम्यया ॥ १०.१ ॥,"श्रीभगवान् बोले—- हे महाबाहो ! फिर भी मेरे परम रहस्य और प्रभाव युक्त्त वचन को सुन, जिसे मै तुझ अतिशय प्रेम रखने वाले के लिये हित की इच्छा से कहूँगा |","Arjuna, my dear devotee, hear and understand these wise words (full of the highest and most divine knowledge) which I shall disclose to you, for your own good.","Arjuna, my dear devotee, hear and understand these wise words (full of the highest and most divine knowledge) which I shall disclose to you, for your own good.",motivation,Bhagavad Gita
10,10.2,न मे विदुः सुरगणाः प्रभवं न महर्षयः । अहमादिर्हि देवानां महर्षीणां च सर्वशः ॥ १०.२ ॥,मेरी उत्पति को अर्थात्त् लीला से प्रकट होने को न देवता लोग जानते है और न महषि जन ही जानते है; क्योंकि मै सब प्रकार से देवताओ का और महषियों का भी आदिकारण हूँ |,"Even the Deities and the greatest of wiseman do not know the secret of my birth in this world (in human form). You should understand,my dear friend, that it is from ME that all of these Deities and wisemen originate.","Even the Deities and the greatest of wiseman do not know the secret of my birth in this world (in human form). You should understand,my dear friend, that it is from ME that all of these Deities and wisemen originate.",motivation,Bhagavad Gita
10,10.3,यो मामजमनादिं च वेत्ति लोकमहेश्वरम् । असंमूढः स मर्त्येषु सर्वपापैः प्रमुच्यते ॥ १०.३ ॥,"जो मुझको अजन्मा  अर्थात्त् वास्तव में जन्मरहित, अनादि और लोकों का महान ईश्वर तत्व से जानना है, वह मनुष्यों में ज्ञानवान् पुरुष सम्पूर्ण पापो से मुक्त्त हो जाता है|","The Blessed Lord declared: He who fully understands ME (in all respects) as being without a beginning or an end,and Lord of the universe,is truly the wisest person among all men and is released from all his sins.","The Blessed Lord declared: He who fully understands ME (in all respects) as being without a beginning or an end,and Lord of the universe,is truly the wisest person among all men and is released from all his sins.",motivation,Bhagavad Gita
10,10.4,बुद्धिर्ज्ञानमसंमोहः क्षमा सत्यं दमः शमः । सुखं दुःखं भवोऽभावो भयं चाभयमेव च ॥ १०.४ ॥,"निश्चय करने की शक्त्ति, यथार्थ ज्ञान,  असम्मूढता, क्षमा, सत्य, इन्द्रियों का वश में करना, मन का निग्रह तथा सुख-दुःख, उत्पत्ति-प्रलय और भय-अभय तथा अहिंसा, समता, संतोष, तप, दान, कीर्ति और अपकीर्ति–ऎसे ये प्राणियो के नाना प्रकार के भाव मुझ से ही होते है|","The intellect, the GYAN (Supreme Knowledge), understanding, forbearance, truth, control over the mind and senses, joys, sorrows, birth, death, fear, fearlessness, non-violence, even-mindedness, contentment, austerity, charity, fame, infamy, all of these and other diverse elements that surround life in this world, arise and begin from ME, the Supreme Soul.","The intellect, the GYAN (Supreme Knowledge), understanding, forbearance, truth, control over the mind and senses, joys, sorrows, birth, death, fear, fearlessness, non-violence, even-mindedness, contentment, austerity, charity, fame, infamy, all of these and other diverse elements that surround life in this world, arise and begin from ME, the Supreme Soul.",anxiety,Bhagavad Gita
